label,tweet
happy,Ini adalah hal yang paling membahagiakan saat biasku foto bersama ELF #ReturnOfTheLittlePrince #HappyHeeChulDay
anger,"[USERNAME] [USERNAME] Dari pertama [USERNAME] menduduki bangku jabatan anda, rakyat belum pernah mendengar dan melihat hasil kerja dan prestasi nyata yang anda berikan semasa menduduki bangku jabatan.Coba tanya Kenapa [USERNAME] ? Abdi rakyat butuh seoran"
fear,"yaudah kalo emang belum berani potong rambut pendek ya nanti"" aja kalo emang udah yakin dan bisa nyaman  Selamat beristirahat, jangan lupa berdoa Tidur yg nyenyak & mimpi yg indah Good night cit "
fear,"Jadi semalam, gw rekap, eh intinya yg gw usahain kerja ternyata zero samsek.. Presentasi jam 16.00, ku baru grasak grusuk jam 13.23. Jiaaaaaaann"
anger,"temen2 masa kecil yang turned out being asshole itu kalo cewe jadi ukhti2 hijrah kalo cowo jadi abdi negara, rasanya semua statement ku di sosmed pasti yang menyangkal orang2 kek gitu, parahnya lagi kalo mereka pacaran bangsat"
sadness,"Terkadang apa yang kau dapati dan miliki saat ini, ada orang lain yang menginginkanya juga. Apapun itu. Karena gak semua beban bisa di tanggung oleh seorang gantleman. Dialog Dini Hari."
fear,"TAMSIL ISLAM NUSANTARA. Karena kau cuma tiang yang dipancang tergesa-gesa kemarin sore dan pangkalmu cuma dangkal-dangkal saja ditanam, maka engkau jadi takut setengah mati pada angin. Bahkan semilir yang segar pun kau caci dan kau kutuki."
anger,"[USERNAME] Skrg gini saja. Sy balik pertanyaannya. Bolehkah kah sy yg bukan Mahasiswa UMI ikut masuk ruang Kuliah dan mengerjakan Tugas Kuliah sprt Mhs lainnya? Bukan persoalan Ada larangan atau tidak. Tapi apa Gunanya Saya ikut Perkuliahan, kalo Saya n"
love,"Kalo kamuuuuuu, kamuu itu specialll. Cintanya juga ga kalah kok sama yang lain. Karena sebenernya bagi aku kalian itu satu. Jadi, cinta satu cinta semua. [URL]"
happy,Kasarnya dia bilang kalo pake lg dengerin musik yg kluar slalu musiknya Shinhwa. Bikin pengen joget wkwk xD. Itu namanya autoreaction sih xD [URL]
sadness,[USERNAME] Gua kelas 1sd bawa hp karna buat hubungin mama. Tau tau dicolong temen. Gua diem aja bego emg. Bibi kantin ngabarin nyokap gua dan lgsg datang lah mama trs bapanya minta maaf. Eh beberapa hari kemudian anaknya pindah sklh. Ya
love,"[USERNAME] ""Cinta tak butuh pengorbanan. Pada saat kau merasa berkorban, pada saat itu cintamu mulai pudar."" Ini wejangan dari mbah [USERNAME]"
love,Romantis itu MANIS lebih manis lagi kalo dilakuin orang tg kita SAYANG. Semua bakal terasa seneng dan berbunga bunga wkwk. Seperti ada ribuan kupu kupu terbang yg ada dii perut kalo lagi ada yg ngeromantisin gitu.
fear,tapi ngeri sih ya emang akun gede dengan followers ribuan tuh kalo ngetweet yg jelek atau salah dikit yg hujat langsung banyak AKU TAKUT KALIAN UNFOLLOW AKU AJA PLEASE
sadness,Kapan bandara [USERNAME] 1 di Ambon ada perbaikan dan mungkin renofasi. Melihat ada banyak perkembangan bandara di daerah lain rasanya sudah amat ketinggalan sebagai bandara internasional . [URL]
love,pantesan ada notif di FB. hari ini 4 thn yg lalu video ini bikin gw makin yakin jatuh cinta pada pandangan pertama sama doi an awal adekgemas fever melanda
happy,"Jadi sejauh ini, udah ada 6 barang yang ku beli hasil flash salenya bukalapak. OMG dari harga yang Ratusan Ribu yang bahkan aku sbg sahabat misqin tak mampu beli, sekarang kebeli semua wkwkwkwk. Dan masih ada flash sale jam 6 sore, jam 8 malam dan jam 12 malam"
love,"Semoga sehat selalu, dan yg terpenting selalu sayang dan cinta ama [USERNAME], walaupun gw itu followers baru tp kita bisa saling kenal krn kita keluarga we are family I love you"
anger,si gendut kalau saya yang suruh ogah jalan! dasar kebo!
fear,"gue yg dulu bingung knp org bisa trauma berkepanjangan skrg baru sadar setelah ngerasain sendiri, kita ga speak up kdg krn takut dibilang lebay lah boong lah bla bla. ngatasin traumanya aja udh susah tmbh lg di judge org lain jd mending diem."
anger,[USERNAME] [USERNAME] gk perlu mnta maap juga kalik.. beda perspektif mah wajar.. yg lebay mah ngapus twit neg bkn bela simic jg tp slama vv gk lapor pulisi bhwa dia udh jadi korban pelecehan mah itu msh tetep urusan private mreka bdua di DM gmn awa
sadness,"[USERNAME] iPhone 7 plus, tiba tiba restart sendiri, trus kadang kadang bootloop ga masuk ke system , dimatikan agak lama, baru kadang bisa masuk system. kenapa bruh"
sadness,"Wah gila sih, ini lokasinya mirip2 selly oal & dixy, persis pula di pengkolan jalan. Sayang dulu ga ada mas2 british kaya gini. Klo ada, mgkn w seringnya nongkrong di dixy bukan di perpus"
anger,"Ngurusin neraka orang, sampai bikin hastag #CalonPenghuniNeraka, sedangkan sholatlu masih bolong bolong, Al Qur'an mu masih tersimpan rapi di almari, dan uangmu masih belum berkurang untuk sedekah, pikir dong!!!"
happy,"Sama kayak bahagia. Mau gimanapun persepsi orang tentang bahagia, kalau bahagiamu memang beda dari persepsi orang2, itu tetap bahagia kamu. Orang lain gak ngerasain, tapi kamu yg ngerasain ttg bahagia kamu."
anger,"DPRRI pemegang amanah rakyat tetapi selalu membalikan telapak tangan, Dewan yg membuat aturan dan Dewan pula yg melanggar aturan, segelintir Dewan mencoreng amanah rakyat dgn melakukan korupsi, jls bersalah dan selalu berkelit menutupi kesalahan dgn bersandiwara"
anger,Belajar jadi oposisi dimana partai ini... kok nyinyir dan provokatif sekali. Ini tanda juga tidak mampu jadi oposisi yg baik. [URL]
sadness,"berita Via Vallen dapet DM dari pemain sepak bola yang terkesan ""menggoda"" atau sexual harassment, liat komennya pada bilang lebay dan gak harus di publish karena hal kek gitu ""biasa aja"" dan parahnya yang nyinyir perempuan juga :') miris"
sadness,"Abis jengukin temen yg sakit parah. Terus terenyuh sama kata2nya, ""saya ga takut sama penyakit saya, saya cuma takut ramadhan saya ga dapet berkah"" Ya Allah  Mohon doa, buat kesembuhan temen kantor saya, Tb adriana Pramudya bin tb dasep. [URL]"
sadness,"[USERNAME] Masalahnya banyak bgt sih yg gamau belajar dari sejarah. Padahal sejarah dunia ya gitu2 aja, muter2 disitu. Tapi gue lebih miris sama org yg masih menganggap Saudi dan US adalah dua kubu yg bersebrangan"
fear,Liat temen-temen udah pada kewong aja . Ngeri juga kalau w mikirin sampe kapan ya w kewong dengernya itu loh . Masalahnya w belum kepikiran masih takut
sadness,Ya nasib 3 thn eh 4 thn sudah nggak lebaran di rumah plus lebaran ini sepertinya begitu....padahal bayangannya tahun ini lebaran dirumah nyatanya lebaran dikantor (lagi #nasib #alhamdulillah
happy,SUNDA KELAPA Alhamdulillah abis tarawih di Masjid Agung Sunda Kelapa. Nikmat sekali. 23 rekaat tapi nikmat karena bacaan imamnya mantap. Ini masjid persembahan Gubernur Ali Sadinin utk masyarakat Jakarta. Yuk coba tarawih di sini Pak Gub [USERNAME] dan Pak Wagub [USERNAME] [URL]
anger,"Efek pintu tol slipi arah semanggi ditutup, macet parah di sini. Pak polisi bukan ngatur malah jagain jalur busway [USERNAME] [USERNAME] [USERNAME] [URL]"
anger,"[USERNAME] [USERNAME] Setuju bang yg beginian bikin hidupnya gk tenang aj ya,gk mikirin yg lain ky gmn nyari orderan pengen enak sendiri aj jadinya ,gw aj gedeg bener yg bikin opik begituan"
happy,Para raja dan sultan yang tergabung dalam Forum Silaturrahmi Kraton Nusantara merasa bangga dan terharu mendapat undangan dari Presiden [USERNAME] ke Istana. Menurut mereka Presiden benar2 memperhatikan budaya Nusantara [URL]
sadness,cewek-cewek lain kalo bikin instastory suaranya pada cakep bgttt alus gitu ye kan. kalah manisnya gula mah. lah w dengerin suara sendiri aja kek tikus kejepit:( annoying bgt suara qu wkwkwk
fear,"[USERNAME] Yess aku terlalu pemilih dan kriteriaku suka ketinggian gitu, terlebih lagi aku bosenan, takut aja gitu pas udah nikah tau tau bosen :("
happy,"Buat saya, apa yang dilakukan Via Valen simbol perlawanan yang perlu didukung, apapun profesinya wanita tetap harus dihormati dan dihargai [URL]"
anger,"SEBAB MUNDUR ADALAH SEBUAH PENGHIANATAN, DIBELAKANG PAGAR TRIBUN KAMI TERUS BERSUARA UNTUK BANGKITKAN SEMANGAT PEMAIN DILAPANGAN! INI SUARA KAMI."
sadness,"Sebagai manusia yang punya phobia tempat sempit dan sesak, liat penyelamatan anak anak yang terjebak di dalam gua di Thailand, cm bs berdoa, merinding, pengen nangis :"") bergidik liat medannya. #ThaiCaveRescue"
sadness,[USERNAME] @ bapak presiden yang terhormat.mohon bantuan jalan kami di kota pasuruandan kabupaten pasuruan rusak parah. Mohon bantuan bapak presiden untuk meninjau jalan kota pasuruan dan kabupaten pasuruan jawa timur. Rakyat tersiksa dengan jalan yang rusak
love,"[Satu menit kemudian] Ternyata bukan dari satu menit yg lalu, tapi sejak dua hari yang lalu gw udah jatuh cinta sama lu... Salah sapa coba?"
fear,"Kemarin habis sulam alis 6D, dan hari ini terlihat masih ketebalan kaya sincan karna hasil lukanya mengering. Biasanya peel off setelah 7 hari ntar hasilnya kaya bulu alis alami. Semoga ye, gak sia-sia wa nahan sakit sama jauh-jauh ke kelapa gading... [URL]"
sadness,Kppn punya akun fb? Ig? Twitter? Apa yg boleh dipost kppn dan apa yg enggak? Apa yg bisa diketahui umum apa yg enggak? Apa kami sempet update medsos kantor sdgkan medsos kami jg susah cari konten. (dyaar)
sadness,"Selamat jalan adik kami, Semua yang hidup pasti akan meninggal, dan kembali kepada Allah inna lillahi wa inna ilahirojiun"
anger,"anjiir via vallen digituin sm nih org dan dia casually cm blg ""are u angry"" hmm emang hal kaya gitu sebiasa itu sih buat orang luar terutama asal negara2 eropa"
sadness,"[USERNAME] intinya mah lakukan perubahan di dunia nyata aja apapun hasilnya, daripada cuma sampaikan opini di socmed yang seringnya malah nimbulin pro kontra tanpa merubah keadaan yg ada"
anger,"Jahat banget mbaknya,semoga mbaknya nggak jadi korban sexual harrasment juga yaa mbak biar ngga ngerasain gmana rasanya di lecehkan. Wah kesel bacanya pengen bilang tolol ke si mbaknya :( [URL]"
